{
  "packet_id": "TIM-E008-LAMAGUE-BRIDGE",
  "observability_class": "INSTRUMENTED_COLLABORATOR",
  "evidence": [
    {
      "branch_id": "obs_tur_printed",
      "key": "tur.operator",
      "provenance": "OBSERVED",
      "value": "100 ≥ 110 → PASS",
      "operator": "≥",
      "source_ref": "synthetic_image:E008"
    },
    {
      "branch_id": "decl_tur_rule",
      "key": "tur.operator",
      "provenance": "DECLARED",
      "value": "A ≤ RHS",
      "operator": "≤",
      "source_ref": "benchmark_protocol:E008"
    },
    {
      "branch_id": "calc_tur_check",
      "key": "tur.check",
      "provenance": "CALCULATED",
      "value": true,
      "operator": "≤",
      "source_ref": "deterministic_engine"
    }
  ],
  "unknowns": [],
  "conflicts": [
    {
      "conflict_id": "tur_operator_conflict",
      "branch_ids": ["obs_tur_printed", "decl_tur_rule"],
      "dimensions": ["OPERATOR", "VALUE"],
      "status": "UNRESOLVED"
    }
  ],
  "intents": [
    {"timestamp": 1, "key": "evidence_preservation", "value": 1, "scale": 1, "weight": 1},
    {"timestamp": 2, "key": "evidence_preservation", "value": 1, "scale": 1, "weight": 1},
    {"timestamp": 3, "key": "evidence_preservation", "value": 1, "scale": 1, "weight": 1},
    {"timestamp": 4, "key": "evidence_preservation", "value": 1, "scale": 1, "weight": 1},
    {"timestamp": 5, "key": "evidence_preservation", "value": 1, "scale": 1, "weight": 1}
  ],
  "actions": [
    {"timestamp": 1, "key": "evidence_preservation", "value": 1, "source_ref": "model_run_1"},
    {"timestamp": 2, "key": "evidence_preservation", "value": 1, "source_ref": "model_run_2"},
    {"timestamp": 3, "key": "evidence_preservation", "value": 0, "source_ref": "model_run_3"},
    {"timestamp": 4, "key": "evidence_preservation", "value": 0, "source_ref": "model_run_4"},
    {"timestamp": 5, "key": "evidence_preservation", "value": 0, "source_ref": "model_run_5"}
  ],
  "invariants": [
    {"timestamp": 1, "name": "do_not_silently_repair", "preserved": true, "weight": 1},
    {"timestamp": 2, "name": "do_not_silently_repair", "preserved": true, "weight": 1},
    {"timestamp": 3, "name": "do_not_silently_repair", "preserved": false, "weight": 1},
    {"timestamp": 4, "name": "do_not_silently_repair", "preserved": false, "weight": 1},
    {"timestamp": 5, "name": "do_not_silently_repair", "preserved": false, "weight": 1}
  ],
  "boundary": {
    "discrepancy_threshold": 0.30,
    "critical_threshold": 0.70,
    "recovery_horizon": 2,
    "minimum_invariant_preservation": 0.95
  },
  "blocked_operations": ["canonical_merge", "dependent_tim_metrics"]
}
